ASIN,Title,Brand,Latest Selling Price,Latest BSR,Reviews,Ratings,Sentiment Score,Details Changed,Original Price,Last Day Selling Price,Last Day BSR,Estimated Sales,Fulfilled,Availability,Category,Gender
B00N5K46NO,"Godrej Cinthol Original Talc, 300g",Cinthol,160,27,1218,4.5,NA,NA,160,160,25,50,Fulfilled,1,Talcum Powders,
B00JJGW4M8,"NIVEA Talcum Powder for Men & Women, Musk, For Gentle Fragrance & Reliable Protection Against Body Odour, 400 g",Nivea,224,3,9526,4.3,NA,NA,249,224,3,81,Fulfilled,1,Talcum Powders,
B07DJNX6JH,"Candid Activ Sweat Control Talc, 100 g (Pack of 2), White",Candid,208.6,42,546,4.1,NA,NA,298,208.6,46,38,Fulfilled,1,Talcum Powders,
B0050QW3H2,"NIVEA Talcum Powder for Men & Women, Musk, For Gentle Fragrance & Reliable Protection Against Body Odour, 100 g",Nivea,90,31,1241,4.2,NA,NA,99,90,29,47,Fulfilled,1,Talcum Powders,
B01N3C4SYM,"Yardley London Morning Dew Perfumed Talc for Women, 250g powder",Yardley,196,4,5134,4.4,NA,NA,230,196,6,79,Fulfilled,1,Talcum Powders,
B07BDNBD5F,"Nycil Cool Herbal, 150g + Free Glucon-D Orange 100g",Heing,130,420,39,4.2,NA,NA,130,130,424,13,NA,1,Talcum Powders,
B00N5K47H4,Godrej Cinthol Lime Talcum Powder (300g) | Superior Germ Protection | Insta Deo Fragrance,Cinthol,160,14,3544,4.4,NA,NA,160,160,19,62,Fulfilled,1,Talcum Powders,
B07D215X2T,Nycil Cool Gulabjal Prickly Heat Powder 150g + 50g Nycil Powder Worth Rs 37/- (Any Variant) Free,Neelawala,130,227,6,4.3,NA,NA,130,130,160,18,NA,1,Talcum Powders,
B086KMYNLY,"Nycil Cool Lime Prickly Heat Talcum Powder, 150 g",Nycil,169,95,7,4.5,NA,NA,170,169,94,25,NA,1,Talcum Powders,
B00KENRWH2,"Enchanteur Romantic Perfumed Talc for Women, 250g with Roses & Jasmine Extracts",Enchanteur,231,5,5219,4.4,NA,NA,285,220,4,76,Fulfilled,1,Talcum Powders,
B00CQ40O90,"POND'S Magic Acacia Honey Fragrance Talcum Powder 400 g, Cooling Fresh Talc for Face & Body - For Men & Women",Pond'S,277,6,3515,4.4,NA,NA,365,306,10,74,Fulfilled,1,Talcum Powders,
B00CQ414LW,"POND'S Dreamflower Fragrant Talcum Powder, Pink Lily, 400 g",Pond'S,279,1,9194,4.4,NA,NA,340,279,2,88,Fulfilled,1,Talcum Powders,
B07G2QYWLP,"Shower To Shower Prickly Heat Powder, Mint, 150g",Shower To Shower,105,62,425,4.4,NA,NA,110,105,65,34,NA,1,Talcum Powders,
B006LXD6C4,Axe Signature Denim Cologne Talc 300 g,Axe,147,,4353,4.3,NA,NA,185,147,,,NA,1,Talcum Powders,
B00FX03IBK,"Premium Beauty Talc, 300g (Buy 1 Get 1 Free)",Premium,185,23,437,4.1,NA,NA,185,185,26,52,Fulfilled,1,Talcum Powders,
B091PWH27F,Beautisoul Sweet Pea Talcum Powder 300 gm | IFRA Certified Fragrance | Made in India | Body Talcum Powder for Summer |,Beautisoul,169,279,25,3.7,NA,NA,199,169,272,16,NA,1,Talcum Powders,
B00FQH5H6O,"NIVEA Talcum Powder for Men & Women, Pure, For Gentle Fragrance & Reliable Protection Against Body Odour, 400 g",Nivea,224,13,5258,4.3,NA,NA,249,223,11,59,Fulfilled,1,Talcum Powders,
B091N6KRVY,Beautisoul Cherry Blossom Talcum Powder 300 gm | Talcum powder for Women | Refreshing Body Talc for Daily Use,Beautisoul,159,219,94,4.1,NA,NA,199,159,200,18,NA,1,Talcum Powders,
B008KH3VUG,"Dermicool Menthol Regular Prickly Heat Powder – 150g (Pack of 2) | Dettol Cool Soap 125g Free | Cooling relief from prickly heat, burning & itching of skin",Dermicool,188,152,634,4.2,NA,NA,250,188,136,23,NA,1,Solid Soap Bars,
B08YKC89XD,"Candid Prickly Heat Powder 120g with Natural ingredients like menthol,neem etc(Pack of 2), White",Candid Prickly,182.16,7,4269,4.3,NA,NA,198,182.16,9,72,Fulfilled,1,Talcum Powders,
B00YXYZWQ6,"Golden Beauty Alpine Dew Talc, 400g (Buy one get one)",Golden Beauty,,42,1300,4.1,NA,NA,,,29,38,NA,0.25,Talcum Powders,
B08WRR7VTQ,"Nycil Germ Expert Prickly Heat Powder, 150gm+50gm, Assorted Fragrances (Cool Herbal)",Nycil,83,64,424,4.3,NA,NA,130,83,106,34,NA,1,Talcum Powders,
B002ZVK88G,"Mysore Sandal Talc, 300g",Mysore,125,57,2039,4.2,NA,NA,125,125,66,34,NA,1,Talcum Powders,
B00UYGK1FY,Nycil Cool Herbal Prickly Heat Powder - Pack of 2,Nycil,230,90,42,4.4,NA,NA,260,230,109,24,NA,1,Talcum Powders,
B08H5WBH1Y,"Nycil Germ Expert Cool Sandal Prickly Heat Powder, Pack of 150 gm",Nycil,125,126,112,4.3,NA,NA,130,130,173,25,NA,1,Talcum Powders,
B09WDB671J,Beardo Ice Blast Talc powder for men | INSTANT ICY COOLING Talcum Powder Men | Combat heat with Menthol 250g,Beardo,230,49,340,4.2,NA,NA,250,230,57,32,Fulfilled,1,Talcum Powders,
B00YXZ1B4W,"BoroPlus Talc Prickly Heat Ice Cool Powder, 150g + 35g Extra",Boroplus,120,54,457,4.2,NA,NA,120,120,50,34,Fulfilled,1,Talcum Powders,
B00CRDO2GQ,"POND'S Sandal Radiance Talcum Powder, Natural Sunscreen, 300 g",Pond'S,288,18,2106,4.3,NA,NA,350,350,28,55,Fulfilled,1,Talcum Powders,
B01412WVSG,"Navratna Cool Mint Fresh Talc | Instant Sweat Absorption and Cooling Effect |Body Odour Protection | Long Lasting Freshness and Fragrance, 400gm",Navratna,221,85,1205,4.3,NA,NA,230,221,122,25,NA,1,Talcum Powders,
B09JWWJVDZ,Cipla Clocip Antifungal Powder 100gm (Pack of 2),Cipla,214,10,509,4.4,NA,NA,238,214,10,67,Fulfilled,1,Talcum Powders,
B00N5K48R8,"Cinthol Cool Talcum Powder | Superior Germ Protection | Insta Deo Fragrance |Pack of 1, (300g)",Cinthol,160,20,4305,4.3,NA,NA,160,160,20,56,Fulfilled,1,Talcum Powders,
B09VP56SXC,Man Matters Anti-Fungal Intimate Powder | Fights Bacterial Infections | Helps to Masks Sweat And Odor | Prevents Chafing And Redness |100 Grams,Man,335,34,54,4.3,NA,NA,349,335,39,40,Fulfilled,1,Talcum Powders,
B00G4UCAD0,"Yardley London Gentleman Classic Deodorizing Talc for Men, 250g",Yardley,196,5,9558,4.3,NA,NA,230,185,4,76,Fulfilled,1,Talcum Powders,
B003GSPFFI,"Biotique Bio Basil and Sandalwood Refreshing Body Powder, Pack of 150g",Biotique,107,22,2808,4.3,NA,NA,160,159,14,56,Fulfilled,1,Talcum Powders,
B09TVSSP42,Generic nycil Talcum Powder Germ Expert Protect Classic Cool Herbal 150gms each Pack of 2,Generic,260,248,13,4.4,NA,NA,260,260,210,19,NA,1,Talcum Powders,
B00I4S8A6Q,"Nycil Cool Herbal with Neem and Pudina Prickly Heat Powder, 150g",Nycil,110,104,41,4,NA,NA,130,110,234,26,NA,1,Talcum Powders,
B00UYGD30Y,Nycil Classic Prickly Heat Powder (150g) - Pack of 2,Nycil,205,205,79,4.1,NA,NA,260,205,174,20,NA,1,Talcum Powders,
B01ET71W2E,"Nycil Prickly Heat Powder - Excel Classic, 150g Bottle",Nycil,89,59,223,4.4,NA,NA,130,89,79,34,NA,1,Talcum Powders,
B07RFHQ37N,"Nycil Cool Herbal, 50G(PACK OF 2) 100G",Heinz,90,1014,,,NA,NA,100,90,1020,9,NA,1,Talcum Powders,
B09YDKT7CS,Candid Dusting Powder | Doctor's Prescribed No.1 brand | Provides Expert Skin Solution | 120 Gm x Pack of 3,Candid,402,36,124,4.5,NA,NA,447,402,31,40,Fulfilled,1,Talcum Powders,
B08DHCKTCC,Dermi Cool Dermicool Prickly Heat Powder - 150g (Sandal)Pack of 1,Dermi Cool,125,150,74,3.9,NA,NA,135,125,158,24,NA,0.75,Talcum Powders,
B07NYJH97S,"Nycil Caring and Protection Prickly Heat Powder - 150 g (Classic, Free Nycil Cool Herbal - 50gm Worth Rupees 40)",Nycil,130,398,,,NA,NA,130,130,376,14,NA,1,Talcum Powders,
B086KJ9CBK,"Nycil Cool Herbal Prickly Heat Talcum Powder, 150 g",Nycil,115,407,1,4,NA,NA,130,115,400,13,NA,1,Talcum Powders,
B015FMVPGK,"NYCIL Cool Chandan with Sandalwood Fragrance Prickly Heat Powder For skin relief, 150g",Nycil,130,220,30,4,NA,NA,130,130,155,18,NA,1,Talcum Powders,
B01NB0YHKG,"Yardley London Lace Satin Perfumed Talc for Women, 250g powder",Yardley,207,24,1062,4.4,NA,NA,230,207,28,51,Fulfilled,1,Talcum Powders,
B00DRE06NM,"Yardley London English Lavender Perfumed Talc for Women, 250g",Yardley,196,9,4241,4.3,NA,NA,205,196,9,68,Fulfilled,1,Talcum Powders,
B09B9K4RW6,"Cipla Clocip Advance Action Prickly Heat Powder (150g, Pack of 2)",Cipla,178,45,232,4.2,NA,NA,230,178,40,34,Fulfilled,1,Talcum Powders,
B06X3QZPJX,"Navratna Maxx Cool Talc |Ice Cooling Effect |For Last Lasting Freshness and Fragrance| Instant Sweat Control, 400gm",Navratna,172,16,6259,4.4,NA,NA,240,186,18,62,Fulfilled,1,Talcum Powders,
B01CNRSA3Q,"Navratna Smart Cool Blast, 100g",Navratna,85.99,323,59,3.9,NA,NA,95,85.99,324,16,NA,1,Talcum Powders,
B00E63DZ7M,"Navratna Cool Talc Mint Fresh, 12g Jar",Navratna,39,775,,,NA,NA,39,39,778,9,NA,1,Talcum Powders,
B077KB116K,Navratna Mint Fresh Talc (100g) - Set of 3,Navratna,210,454,22,4.2,NA,NA,285,210,449,12,NA,1,Talcum Powders,
B00YXYZ6QM,"Navratna Cool Talc Mint Fresh, 50g",Navratna,30,583,1,5,NA,NA,30,30,585,11,NA,1,Talcum Powders,
B07BHPMQCX,"Navratna Mint Fresh Talc, 200gm",Navratna,119,230,7,3.5,NA,NA,119,119,165,18,NA,1,Talcum Powders,
B07856VTPV,"Navratna Cool Talc - Mint Fresh, 100g Bottle",Navratna,83,405,14,3.6,NA,NA,95,83,403,13,NA,1,Talcum Powders,
B08Y8LLSXB,"Dermifresh Prickly Heat Talcum Powder for Amazing Cooling, Refreshment and Helps to Instant Relief from Sweating & Long Lasting Freshness 150g each - Pack of 4, Rose Fragrance…",Dermifresh,349,273,8,4.1,NA,NA,380,349,235,18,Fulfilled,1,Talcum Powders,
B091N5XQ88,Beautisoul Cherry Blossom Talcum Powder 100 gm | IFRA Certified Fragrance | Talcum powder for Women,Beautisoul,99,56,247,4.1,NA,NA,99,99,58,34,NA,1,Talcum Powders,
B00MUKR09M,"Enchanteur Charming Perfumed Talc for Women, 250g with Roses, Muguets & Cedarwood Extracts powder",Enchanteur,211,21,2326,4.3,NA,NA,285,211,28,54,Fulfilled,1,Talcum Powders,
B07NJVMYZQ,"Dermicool Menthol Regular Prickly Heat Powder – 150g (Pack of 3) | Dettol Cool Soap 125g Free | Cooling relief from prickly heat, burning & itching of skin",Dermicool,375,161,96,4.2,NA,NA,375,375,186,23,NA,1,Solid Soap Bars,
B07VN7SCFM,Dermi COOL Menthol Regular 150g,Dermi Cool,110,117,56,3.9,NA,NA,125,110,160,27,NA,1,Talcum Powders,
B09VGSLZSY,"Candid Activ sweat control talc, 100 g",Candid,140,93,8,3.6,NA,NA,149,140,93,25,Fulfilled,1,Talcum Powders,
B07HW1RKDR,DERMICOOL PRICKLY HEAT POWDER (Regular)-150gm (pack of 2),Dermicool,334,689,3,4,NA,NA,499,334,687,9,NA,1,Talcum Powders,
B082JN1FZC,"Santoor Talc, 400 GM",Santoor,198,15,2503,4.1,NA,NA,450,198,16,60,Fulfilled,1,Talcum Powders,
B09JNVTSH2,Kalapi Talcum Powder 400 GM (Pack of 1),Generic,399,344,6,5,NA,NA,549,399,334,16,NA,1,Talcum Powders,
B09Y2BTGC2,Madhuram Clofresh Dusting Powder-100gm Pack of 4,Generic,400,697,,,NA,NA,400,400,698,9,NA,1,Talcum Powders,
B09YHZN2K3,"Hesh Neem & Tulsi Herbal Prickly Heat Powder Plus – 150g - Pack of 2 | Cooling relief from prickly heat, burning & itching of skin",Hesh,219,184,5,5,NA,NA,230,219,207,20,NA,1,Talcum Powders,
B008KH3VLK,Dermicool Prickly Heat Powder - 150 g (Lavender),Dermicool,,352,56,3.9,NA,NA,,,358,16,NA,1,Talcum Powders,
B00DRE2ZNG,"GOKUL Santol Talcum Powder, 300g",Gokul,225,26,1779,4.4,NA,NA,225,225,27,51,Fulfilled,1,Talcum Powders,
B06XZN4YGL,Dermi Cool Sandal Powder 150 g,Dermi Cool,,373,38,3.8,NA,NA,,,369,14,NA,1,Talcum Powders,
B077H177YP,"Park Avenue Premium Talc, Sandal, 300g powder(Pack of Buy 1 Get 1 Free)",Park Avenue,,53,1910,3.8,NA,NA,,,70,35,NA,0.25,Talcum Powders,
B08MTNQ7QR,"SHIFATRADERS, Sandal Powder",Shifa,210,497,1,5,NA,NA,320,210,489,12,NA,1,Talcum Powders,
B07CB6SSJZ,"Dermicool Prickly Heat Powder, Sandal - 150g Each (Pack Of 2)",Dermicool,250,348,14,3.7,NA,NA,250,,348,16,NA,1,Talcum Powders,
B09YDKYTVW,"Candid Dusting Powder 250 gm each ,Pack of 3",Candid,675,47,43,4.7,NA,NA,750,675,51,30,Fulfilled,1,Talcum Powders,
B008KH3W3C,Dermicool Prickly Heat Powder - 150gm (Sandal),Dermicool,117,383,77,3.8,NA,NA,117,117,383,13,NA,1,Talcum Powders,
B08HHXQ6WV,"Godrej Cinthol Talcum Powder, Deo, 300g, Pack Of 1",Godrej,160,72,27,4.5,NA,NA,160,160,101,30,NA,1,Talcum Powders,
B00546YWD6,Snake Brand Prickly Heat Cooling Talcum Powder French Lavender | For Heat & Rash Treatment | 140gm,Snake Brand,249,153,485,4.1,NA,NA,249,249,76,26,Fulfilled,1,Talcum Powders,
B08YKGP8WF,"Candid Prickly Heat Powder 120g, white",Candid Prickly,79.2,7,4269,4.3,NA,NA,99,79.2,9,72,Fulfilled,1,Talcum Powders,
B07PYC3F76,Dermicool Nourishing Aloe Vera Talc Powder 150 Gm Bottle,Dermicool,105,266,22,4,NA,NA,125,105,199,17,NA,1,Talcum Powders,
B08YKJ4HJH,"Candid Prickly Heat Powder 120g (Pack of 3), white",Candid Prickly,237.6,7,4269,4.3,NA,NA,297,237.6,9,72,Fulfilled,1,Talcum Powders,
B08Z33GN88,Nycil Powder Germ Expert Protect Cool Herbal 150gms + 50gms worth Rs 40/-# FREE,Generic,125,,414,4.3,NA,NA,130,125,,,NA,1,Face Pack,
B00I4S88K4,"Nycil Cool Gulabjal Powder, 150g",Nycil,114,,216,4.3,NA,NA,130,114,,,NA,1,Compact Powder,
