ASIN,Name
5169498,Dove Intense Repair Shampoo & Eventone Deodorant For Women
5169497,Dove Intense Repair Shampoo & Eventone Deodorant Roll On For Women
4869853,Dove Rich Moisture Shampoo
4138010,"Dove Detox & Purify Dry Shampoo, For Refreshing & Reviving Oily Hair"
3535711,Dove Healthy Ritual Shampoo Conditioner + Mask
3686700,Dove Intense Repair Shampoo + Hair Mask
3686699,Dove Intense Repair Shampoo(650ml) + Hair Mask
5169495,Dove Daily Shine Shampoo & Original Deodorant For Women
982117,Dove Intense Repair Shampoo + Conditioner with Vega Hair Brush Combo
5472324,Dove Intense Repair Complete Care Kit
5169496,Dove Daily Shine Shampoo & Original Deodorant Roll On For Women
936402,L'Oreal Paris 6 Oil Nourish Shampoo 704ml With Conditioner 192.5ml
4749764,L'Oreal Paris Casting Creme Gloss Hair Color 200 Ebony Black + Colour Protect Shampoo
4749758,L'Oreal Paris Extraordinary Oil Combo
3900023,L'Oreal Paris Extraordinary Hair Care Kit
4749759,L'Oreal Paris Long Hair Dreams Kit: Shampoo + Conditioner + No Haircut Cream
936399,L'Oreal Paris Total Repair 5 Shampoo 396ml With Conditioner 192.5ml
3645239,L'Oreal Paris Extraordinary Hair Nourishment Kit
5360366,L'Oreal Paris Total Repair 5 Shampoo With Rapid Reviver Deep Conditioner & Total Repair 5 Serum
4766171,L'Oreal Paris Extraordinary Oil Premium Regime Kit For Smooth Hair
3534901,L'Oreal Paris Extraordinary Hair Kit
3534905,L'Oreal Paris Voluminous Dream Lengths Shampoo + No Haircut Cream + Extraordinary Oil Serum 30ml
5360364,L'Oreal Paris Skin & Haircare Combo - Revitalift 1.5% Hyaluronic Acid Serum & Total Repair 5 Shampoo
4766172,L'Oreal Paris Extraordinary Oil Combo For Smooth Frizz-free Hair
5360365,"L'Oreal Paris Total Repair 5 Shampoo, Pack Of 2"
5610739,L'Oreal Paris Extraordinary Oil Smooth Shampoo & Serum Kit
25555,L'Oreal Paris Fall Resist Anti-Dandruff Shampoo
110459,L'Oreal Paris Excellence Creme Hair Color - 1 Black + Free Total Repair 5 Shampoo
452483,LOreal Paris Total Repair 5 Combo - Shampoo + Free Conditioner + Free Serum worth Rs 349
730080,Biotique Bio Henna Leaf Fresh Texture Shampoo & Conditioner - Pack Of 2
159799,Biotique Hair Regime For Oily Hair
1506999,Biotique Onion Range Combo
159798,Biotique Hair Regime For Dry Hair
730035,Biotique Bio Soya Protein Fresh Nourishing Shampoo - Pack Of 2
730008,Biotique Bio Green Apple Shampoo & Conditioner - Pack of 2
730007,Biotique Bio Walnut Bark Volumizing Shampoo - Pack of 2
1506997,Biotique Total Anti-hairfall Essentails Combo
2809954,Tresemme Keratin Smooth Shampoo + Hold Level 4 Hair Spray
780640,Tresemme Detox & Restore Combo Buy 580 ml Shampoo and Get 190ml Conditioner Free
982105,Tresemme Botanique Shampoo + Conditioner with Vega Hair Dryer Combo
5391987,Head & Shoulders 2 In 1 Anti Dandruff Shampoo & Smooth And Silky Conditioner
499339,Head & Shoulders Smooth & Silky Shampoo + Conditioner (Pack Of 2)
499307,Head & Shoulders Silky Black Anti Dandruff Shampoo (Pack Of 2)
499308,Head & Shoulders Cool Menthol 2-in-1 Shampoo + Conditioner (Pack Of 2)
499340,Head & Shoulders Anti Hair Fall Shampoo (Pack Of 2)
727489,Head & Shoulders Anti-Dandruff Max Cool Shampoo
5980,Head & Shoulders Dry Scalp Care Shampoo
6005,Head & Shoulders Anti Hair Fall Shampoo
