ASIN,Title,Brand,Latest Selling Price,Latest BSR,Reviews,Ratings,Sentiment Score,Details Changed,Original Price,Last Day Selling Price,Last Day BSR,Estimated Sales,Availability,Category,Gender
5169498,Dove Intense Repair Shampoo & Eventone Deodorant For Women,Dove,736,,,4.3,NA,NA,905,736,,0,1,,
5169497,Dove Intense Repair Shampoo & Eventone Deodorant Roll On For Women,Dove,716,,,4.4,NA,NA,895,716,,0,1,,
4583847,Dove Hair Fall Rescue Combo,Dove,977,407,14,4.6,NA,NA,1189,1088,399,0,1,Shampoo,
5071338,Dove Hair Therapy Niacinamide Complete Haircare Combo For Dry Scalp,Dove,1053,419,34,4.5,NA,NA,1549,1053,417,0,1,Shampoo,
1488677,Dove Intense Repair Shampoo + Conditioner,Dove,793,521,11,4.2,NA,NA,1043,793,520,0,1,,
881206,Dove Dandruff Clean & Fresh Shampoo + Conditioner Combo,Dove,677,548,18,4.4,NA,NA,915,677,547,0,1,Combos @ Nykaa,
430561,Dove Intense Repair Combo (Buy 1Ltr Shampoo and Get 190ml Conditioner Free),Dove,754,506,4,4.5,NA,NA,1160,754,532,0,1,Combos @ Nykaa,
881207,Dove Dandruff Care Shampoo + Conditioner Combo,Dove,630,613,1,4.3,NA,NA,852,849,626,0,1,Combos @ Nykaa,
3686701,Dove Healthy Ritual Haircare Combo,Dove,1093,672,6,4.5,NA,NA,1377,1093,680,0,1,,
540668,Dove Intense Repair Shampoo + Damage Solutions Intense Repair Conditioner,Dove,640,715,38,4.3,NA,NA,865,640,720,0,1,Combos @ Nykaa,
4583846,Dove Hair Shine Restoration Combo,Dove,903,786,5,4.6,NA,NA,1204,903,782,0,1,Shampoo,
5788872,Dove Hydrating Cleanse Shampoo For Curly,Dove,999,869,,3,NA,NA,999,999,876,0,1,Shampoo,
3686702,Dove Healthy Ritual Strengthening Shampoo(650ml) + Hair Mask,Dove,931,887,5,4.5,NA,NA,1187,931,895,0,1,,
1488679,Dove Intense Repair Shampoo + Conditioner + Mask,Dove,1184,897,,4.4,NA,NA,1568,1184,899,0,1,,
4138010,"Dove Detox & Purify Dry Shampoo, For Refreshing & Reviving Oily Hair",Dove,509,,,3.3,NA,NA,599,509,,0,1,,
3535711,Dove Healthy Ritual Shampoo Conditioner + Mask,Dove,1093,,,4.4,NA,NA,1377,1093,,0,1,,
3686700,Dove Intense Repair Shampoo + Hair Mask,Dove,1091,,,4.5,NA,NA,1495,1091,,0,1,,
3686699,Dove Intense Repair Shampoo(650ml) + Hair Mask,Dove,908,,,4.4,NA,NA,1200,908,,0,1,,
5169495,Dove Daily Shine Shampoo & Original Deodorant For Women,Dove,752,,,4.5,NA,NA,925,752,,0,1,,
982117,Dove Intense Repair Shampoo + Conditioner with Vega Hair Brush Combo,Dove,1214,,,4.3,NA,NA,1415,1214,,0,1,Combos @ Nykaa,
5472324,Dove Intense Repair Complete Care Kit,Dove,1863,,516,4.4,NA,NA,1863,1863,,0,1,,
5169496,Dove Daily Shine Shampoo & Original Deodorant Roll On For Women,Dove,732,,,4.5,NA,NA,915,732,,0,1,,
5950,Dove Intense Repair Shampoo,Dove,728,49,510,4.4,NA,NA,970,728,49,0,1,Shampoo,
10229,Dove Intense Repair Conditioner,Dove,276,58,679,4.5,NA,NA,368,276,58,0,1,Conditioner,
5946,Dove Hair Fall Rescue Shampoo,Dove,637,7,631,4.4,NA,NA,849,749,7,0,1,Shampoo,
453991,Dove Healthy Ritual For Strengthening Hair Shampoo,Dove,563,71,411,4.4,NA,NA,662,563,73,0,1,Shampoo,
5940,Dove Daily Shine Shampoo,Dove,637,77,385,4.4,NA,NA,849,637,79,0,1,Shampoo,
540667,Dove Healthy Ritual For Strengthening Hair Shampoo + Conditioner,Dove,605,83,14,4.3,NA,NA,852,605,84,0,1,Combos @ Nykaa,
4586546,Dove Hair Therapy Breakage Repair Shampoo Sulphate and Parabens free With Nutri-Lock Serum,Dove,338,82,155,4.3,NA,NA,450,338,85,0,1,Shampoo,
5071339,Dove Hair Therapy Breakage Repair With Nutri-lock Serum Shampoo + Conditioner,Dove,712,142,4,4.3,NA,NA,949,712,145,0,1,Shampoo,
453983,Dove Healthy Ritual For Growing Hair Shampoo,Dove,563,150,473,4.3,NA,NA,662,563,153,0,1,Shampoo,
540666,Dove Healthy Ritual For Growing Hair Shampoo + Conditioner,Dove,605,170,17,4.4,NA,NA,852,605,172,0,1,Combos @ Nykaa,
739951,Dove Dandruff Clean & Fresh Shampoo,Dove,293,192,123,4.3,NA,NA,345,293,194,0,1,Shampoo,
5071340,Dove Hair Therapy Breakage Repair Complete Haircare Combo With Nutri-lock Serum,Dove,1102,200,33,4.4,NA,NA,1549,1162,200,0,1,Shampoo,
4586543,Dove Hair Therapy Dry Scalp Care Shampoo Sulphate and Parabens Free With Niacinamide,Dove,338,216,84,4.3,NA,NA,450,338,220,0,1,Shampoo,
5941,Dove Dryness Care Shampoo,Dove,281,248,200,4.4,NA,NA,330,281,251,0,1,Shampoo,
4583845,Dove Intense Hair Repair Combo,Dove,1004,302,520,4.4,NA,NA,1338,1004,308,0,1,Shampoo,
5071337,Dove Hair Therapy Niacinamide Shampoo + Conditioner Combo For Dry Scalp,Dove,645,310,4,4.4,NA,NA,949,645,313,0,1,Shampoo,
14292,Dove Dandruff Care Shampoo,Dove,563,316,253,4.4,NA,NA,662,563,321,0,1,Shampoo,
24274,Dove Oxygen Moisture Shampoo,Dove,530,336,452,4.3,NA,NA,662,530,339,0,1,Shampoo,
2638478,Dove Hair Fall Rescue Shampoo,Dove,72,331,6,4.4,NA,NA,72,72,335,0,1,Shampoo,
1482406,Dove Daily Shine Shampoo + Conditioner,Dove,798,385,9,4.4,NA,NA,1050,798,388,0,1,,
5504819,L'Oreal Professionnel Metal Dx Shampoo & Hair Mask Combo Serie Expert,L'Oreal Professionnel,2340,79,5,4.5,NA,NA,2600,2340,81,0,1,Combos @ Nykaa,
3608269,"L'Oreal Professionnel Pro Longer Shampoo For Long Hair With Thinned Ends, Serie Expert",L'Oreal Professionnel,695,113,38,4.4,NA,NA,695,695,116,0,1,Shampoo,
1328947,L'Oreal Professionnel Mythic Oil Shampoo + Masque + Oil,L'Oreal Professionnel,2808,135,45,4.4,NA,NA,3120,2808,138,0,1,Combos @ Nykaa,
3798201,"L'Oreal Professionnel Anti-hair Loss Regime With Density Advanced Shampoo And Aminexil, Serie Expert",L'Oreal Professionnel,2381,136,17,4.3,NA,NA,2645,2381,141,0,1,,
72158,L'Oreal Professionnel Mythic Oil Shampoo & Masque,L'Oreal Professionnel,1919,160,26,4.3,NA,NA,2020,1919,161,0,1,Combos @ Nykaa,
6788978,L'Oreal Professionnel Pro Longer Lengths-Renewing Regime Shampoo + Ampuole,L'Oreal Professionnel,1958,625,1,4.4,NA,NA,2175,1958,646,0,1,,
5342883,L'Oreal Professionnel Metal Dx Anti-Metal Cleansing Cream Shampoo Serie Expert,L'Oreal Professionnel,1200,1,24,4.5,NA,NA,1200,1200,1,0,1,Shampoo,
18402,"L'Oreal Professionnel Absolut Repair Shampoo with Protein and Gold Quinoa, Serie Expert",L'Oreal Professionnel,695,11,1191,4.4,NA,NA,695,695,11,0,1,Shampoo,
10500,LOreal Professionnel X-Tenso Care Pro-Keratine + Incell Shampoo,L'Oreal Professionnel,610,13,1288,4.3,NA,NA,610,610,13,0,1,Shampoo,
874067,L'Oreal Professionnel X-Tenso Care Shampoo Sulfate Free,L'Oreal Professionnel,950,14,385,4.3,NA,NA,950,950,14,0,1,Shampoo,
72139,"L'Oreal Professionnel Absolut Repair Shampoo 300ml & Hair Mask 250gm Combo, Serie Expert",L'Oreal Professionnel,1477,17,21,4.4,NA,NA,1555,1477,17,0,1,Combos @ Nykaa,
1323563,L'Oreal Professionnel X-Tenso Care Sulfate free Shampoo & Masque,L'Oreal Professionnel,1914,18,12,4.3,NA,NA,2015,1914,18,0,1,Combos @ Nykaa,
1328949,L'Oreal Professionnel X-Tenso Shampoo + Masque + Serum,L'Oreal Professionnel,1862,20,72,4.4,NA,NA,1960,1862,20,0,1,Combos @ Nykaa,
10506,LOreal Professionnel Series Expert Resveratrol Vitamino Color Shampoo,L'Oreal Professionnel,695,21,417,4.4,NA,NA,695,695,21,0,1,Shampoo,
72164,L'Oreal Professionnel X-Tenso Care Pro-Keratine Shampoo & Masque,L'Oreal Professionnel,1264,22,8,4.3,NA,NA,1330,1264,23,0,1,Combos @ Nykaa,
10495,L'Oreal Professionnel Expert Density Advanced Shampoo,L'Oreal Professionnel,695,26,381,4.3,NA,NA,695,695,27,0,1,Shampoo,
10499,"L'Oreal Professionnel Liss Unlimited Shampoo with Pro-Keratin and Kukui Nut Oil, Serie Expert",L'Oreal Professionnel,695,27,644,4.1,NA,NA,695,695,28,0,1,Shampoo,
1328938,"L'Oreal Professionnel Absolut Repair Shampoo 300ml, Hair Mask 250gm & Hair Serum 90ml, Serie Expert",L'Oreal Professionnel,2480,29,14,4.4,NA,NA,2755,2480,29,0,1,Combos @ Nykaa,
72162,"L'Oreal Professionnel Vitamino Color Shampoo 300ml & Hair Mask 250gm, Serie Expert",L'Oreal Professionnel,1477,33,42,4.4,NA,NA,1555,1477,33,0,1,Combos @ Nykaa,
208219,"L'Oreal Professionnel Inforcer Strengthening Shampoo with Vitamin B6 & Biotin, Serie Expert",L'Oreal Professionnel,695,35,541,4.4,NA,NA,695,695,36,0,1,Shampoo,
10497,LOreal Professionnel Instant Clear Piroctone Olamine Serie Expert Anti Dandruff Shampoo,L'Oreal Professionnel,695,34,673,4.3,NA,NA,695,695,34,0,1,Shampoo,
3798202,"L'Oreal Professionnel Xtenso Care Sulfate Free Hair Care Regime With Shampoo, Masque And Serum",L'Oreal Professionnel,2381,41,2,4.4,NA,NA,2645,2381,42,0,1,,
1321112,"L'Oreal Professionnel Inforcer Strengthening Shampoo 300ml & Hair Mask 250gm Combo, Serie Expert",L'Oreal Professionnel,1477,51,14,4.4,NA,NA,1555,1477,53,0,1,Combos @ Nykaa,
1323562,"L'Oreal Professionnel Liss Unlimited Shampoo 300ml & Hair Mask 250gm for frizzy hair, Serie Expert",L'Oreal Professionnel,1477,62,33,4.2,NA,NA,1555,1477,62,0,1,Combos @ Nykaa,
10503,L'Oreal Professionnel Mythic Oil Argan Oil Rich Shampoo,L'Oreal Professionnel,990,63,157,4.3,NA,NA,990,990,65,0,1,Shampoo,
1328952,"L'Oreal Professionnel Liss Unlimited Shampoo 300ml, Hair Mask 250gm & Hair Serum 125ml, Serie Expert",L'Oreal Professionnel,2039,66,10,4.3,NA,NA,2265,2039,66,0,1,Combos @ Nykaa,
1162179,L'Oreal Paris Dream Lengths Shampoo,L'Oreal Paris,575,23,1037,4.4,NA,NA,959,575,24,0,1,Shampoo,
6671067,L'Oreal Paris Hyaluron Moisture 72H Moisture Filling Shampoo,L'Oreal Paris,721,24,44,4.3,NA,NA,1029,721,26,0,1,Shampoo,
10970,L'Oreal Paris Total Repair 5 Shampoo,L'Oreal Paris,569,55,1354,4.4,NA,NA,949,569,55,0,1,Shampoo,
10672,L'Oreal Paris 6 Oil Nourish Shampoo,L'Oreal Paris,479,57,823,4.4,NA,NA,799,479,59,0,1,Shampoo,
1370749,L'Oreal Paris Long Hair Dreams,L'Oreal Paris,1134,64,25,4.4,NA,NA,1417,1414,64,0,1,Combos @ Nykaa,
936397,LOreal Paris Total Repair 5 Shampoo 704ml With Conditioner 192.5ml And Serum 40ml(936.5ml),L'Oreal Paris,712,59,249,4.4,NA,NA,1093,712,61,0,1,Hair Care,
220222,L'Oreal Paris Extraordinary Clay Shampoo,L'Oreal Paris,493,78,1849,4.4,NA,NA,699,457,80,0,1,Shampoo,
6282,L'Oreal Paris Colour Protect Shampoo,L'Oreal Paris,296,105,340,4.4,NA,NA,349,296,107,0,1,Shampoo,
4317603,L'Oreal Paris Extraordinary Oil Smooth Shampoo(Paraben & Silicone Free) 440ml| Nourishing Shampoo,L'Oreal Paris,899,122,41,4.3,NA,NA,999,899,125,0,1,Shampoo,
5951,L'Oreal Paris Fall Resist 3x Shampoo,L'Oreal Paris,281,147,182,4.3,NA,NA,329,281,148,0,1,Shampoo,
7286094,L'Oreal Paris Hyaluron Moisture 3-step Routine Hyaluron Moisture Shampoo + Conditioner + Night Cream,L'Oreal Paris,1335,184,3,4.3,NA,NA,1767,1335,197,0,1,Hair,
6790017,L'Oreal Paris Dream Lengths Shampoo With Detangling Conditioner Free,L'Oreal Paris,729,228,3,4.5,NA,NA,948,729,232,0,1,Shampoo,
906457,L'Oreal Paris Bestseller's Regime Nourishment Kit,L'Oreal Paris,1207,306,,4.5,NA,NA,1207,1207,301,0,1,Combos @ Nykaa,
391197,L'Oreal Paris Fall Resist 3X Anti-Hairfall Shampoo,L'Oreal Paris,454,299,182,4.4,NA,NA,649,454,309,0,1,Shampoo,
4749763,L'Oreal Paris Excellence Creme Hair Color Shade 4 - Natural Brown + Colour Protect Shampoo,L'Oreal Paris,670,405,2,4.5,NA,NA,839,670,427,0,1,,
6790016,L'Oreal Paris Total Repair 5 Shampoo With Keratin With Reparing Conditioner Free,L'Oreal Paris,699,390,,4.3,NA,NA,908,699,402,0,1,Shampoo,
7286093,L'Oreal Paris Hyaluron Moisture 2-step Routine Hyaluron Moisture Shampoo + Conditioner,L'Oreal Paris,911,387,,4.3,NA,NA,1268,911,405,0,1,Hair,
1504363,L'Oreal Paris Extraordinary Hair Kit,L'Oreal Paris,1327,526,18,4.5,NA,NA,1327,1327,529,0,1,Combos @ Nykaa,
4749761,L'Oreal Paris Excellence Creme Hair Color Shade 1 - Black + Colour Protect Shampoo,L'Oreal Paris,670,699,2,4.4,NA,NA,839,670,707,0,1,,
4749762,L'Oreal Paris Excellence Creme Hair Color Shade 3 - Darkest Brown + Colour Protect Shampoo,L'Oreal Paris,670,852,2,4.5,NA,NA,839,670,885,0,1,,
936402,L'Oreal Paris 6 Oil Nourish Shampoo 704ml With Conditioner 192.5ml,L'Oreal Paris,515,,15,4.4,NA,NA,739,515,,0,1,Hair Care,
4749764,L'Oreal Paris Casting Creme Gloss Hair Color 200 Ebony Black + Colour Protect Shampoo,L'Oreal Paris,559,,2,4.4,NA,NA,700,559,,0,1,,
4749758,L'Oreal Paris Extraordinary Oil Combo,L'Oreal Paris,569,,12,4.4,NA,NA,763,569,,0,1,Combos @ Nykaa,
3900023,L'Oreal Paris Extraordinary Hair Care Kit,L'Oreal Paris,408,,5,4.4,NA,NA,707,408,,0,1,,
4749759,L'Oreal Paris Long Hair Dreams Kit: Shampoo + Conditioner + No Haircut Cream,L'Oreal Paris,845,,11,4.3,NA,NA,937,845,,0,1,,
936399,L'Oreal Paris Total Repair 5 Shampoo 396ml With Conditioner 192.5ml,L'Oreal Paris,349,,30,4.4,NA,NA,464,349,,0,1,Hair Care,
3645239,L'Oreal Paris Extraordinary Hair Nourishment Kit,L'Oreal Paris,408,,,4.4,NA,NA,707,408,,0,1,,
5360366,L'Oreal Paris Total Repair 5 Shampoo With Rapid Reviver Deep Conditioner & Total Repair 5 Serum,L'Oreal Paris,415,,1,4.4,NA,NA,815,415,,0,1,,
4766171,L'Oreal Paris Extraordinary Oil Premium Regime Kit For Smooth Hair,L'Oreal Paris,1998,,1,4.4,NA,NA,2297,1998,,0,1,,
3534901,L'Oreal Paris Extraordinary Hair Kit,L'Oreal Paris,608,,1,4.4,NA,NA,907,608,,0,1,,
3534905,L'Oreal Paris Voluminous Dream Lengths Shampoo + No Haircut Cream + Extraordinary Oil Serum 30ml,L'Oreal Paris,848,,5,4.4,NA,NA,1147,848,,0,1,,
5360364,L'Oreal Paris Skin & Haircare Combo - Revitalift 1.5% Hyaluronic Acid Serum & Total Repair 5 Shampoo,L'Oreal Paris,499,,,4.2,NA,NA,899,499,,0,1,Combos @ Nykaa,
4766172,L'Oreal Paris Extraordinary Oil Combo For Smooth Frizz-free Hair,L'Oreal Paris,1398,,,4.4,NA,NA,1697,1398,,0,1,,
5360365,"L'Oreal Paris Total Repair 5 Shampoo, Pack Of 2",L'Oreal Paris,540,,,4.4,NA,NA,940,540,,0,1,,
5610739,L'Oreal Paris Extraordinary Oil Smooth Shampoo & Serum Kit,L'Oreal Paris,999,,,4.4,NA,NA,1298,999,,0,1,,
25555,L'Oreal Paris Fall Resist Anti-Dandruff Shampoo,L'Oreal Paris,150,,495,4.3,NA,NA,150,150,,0,1,Shampoo,
110459,L'Oreal Paris Excellence Creme Hair Color - 1 Black + Free Total Repair 5 Shampoo,L'Oreal Paris,620,,9,4.3,NA,NA,620,620,,0,1,,
452483,LOreal Paris Total Repair 5 Combo - Shampoo + Free Conditioner + Free Serum worth Rs 349,L'Oreal Paris,540,,747,4.3,NA,NA,540,540,,0,1,,
1507007,Biotique Onion Haircare Range Combo,Biotique,664,722,14,4.3,NA,NA,910,664,732,0,1,,
1507005,Biotique Argan Haircare Range Combo,Biotique,905,800,1,4.2,NA,NA,1240,905,792,0,1,,
730074,Biotique Bio Walnut Bark Volumizing Shampoo - Pack of 2,Biotique,145,838,,4,NA,NA,198,145,843,0,1,Combos @ Nykaa,
39954,Biotique Bio Neem Margosa Anti - Dandurff Shampoo & Conditioner,Biotique,509,866,32,4,NA,NA,670,670,877,0,1,Shampoo,
1507009,Biotique Banana Shampoo & Hair Mask Combo,Biotique,423,853,6,4.3,NA,NA,580,423,878,0,1,,
598064,Biotique Bhringraj & Kelp Protein Anti-Hair Fall Combo Oil & Shampoo,Biotique,232,891,7,4.4,NA,NA,314,232,891,0,1,Combos @ Nykaa,
159796,Biotique Hair Regime For Coloured Hair,Biotique,348,922,,3.9,NA,NA,477,348,925,0,1,,
1507006,Biotique Argan Shampoo & Conditioner Combo,Biotique,482,954,1,3.8,NA,NA,660,482,974,0,1,,
1507008,Biotique Onion Shampoo & Hair Oil Combo,Biotique,482,950,,4.2,NA,NA,660,482,951,0,1,,
730009,Biotique Bio Henna Leaf Fresh Texture Shampoo & Conditioner - Pack Of 2,Biotique,126,991,,,NA,NA,158,126,989,0,1,Combos @ Nykaa,
730080,Biotique Bio Henna Leaf Fresh Texture Shampoo & Conditioner - Pack Of 2,Biotique,158,,7,4.2,NA,NA,198,158,,0,1,Combos @ Nykaa,
159799,Biotique Hair Regime For Oily Hair,Biotique,417,,6,4.2,NA,NA,529,529,,0,1,,
1506999,Biotique Onion Range Combo,Biotique,664,,,4.3,NA,NA,910,664,,0,1,,
159798,Biotique Hair Regime For Dry Hair,Biotique,426,,5,4,NA,NA,583,426,,0,1,,
598186,Biotique Bio Apple Blossom Shampoo For Disney Kids,Biotique,128,273,87,4.5,NA,NA,169,169,274,0,1,Hair Care,
730035,Biotique Bio Soya Protein Fresh Nourishing Shampoo - Pack Of 2,Biotique,126,,4,5,NA,NA,158,126,,0,1,Combos @ Nykaa,
730008,Biotique Bio Green Apple Shampoo & Conditioner - Pack of 2,Biotique,134,,9,4.8,NA,NA,158,158,,0,1,Combos @ Nykaa,
730007,Biotique Bio Walnut Bark Volumizing Shampoo - Pack of 2,Biotique,142,,2,4.5,NA,NA,158,158,,0,1,Combos @ Nykaa,
1506997,Biotique Total Anti-hairfall Essentails Combo,Biotique,613,,,4.2,NA,NA,778,778,,0,1,,
357142,Biotique Bio Kelp Protein Shampoo for Falling Hair Growth Treatment,Biotique,329,45,4506,4.1,NA,NA,450,79,46,0,1,Shampoo,
516572,Biotique Bio Neem Margosa Anti-Dandruff Shampoo & Conditioner,Biotique,329,96,1531,4.2,NA,NA,450,89,98,0,1,Shampoo,
357134,Biotique Bio Green Apple Fresh Daily Purifying Shampoo & Conditioner,Biotique,438,110,1088,4.2,NA,NA,600,155,112,0,1,Shampoo,
386434,Biotique Bio Soya Protein Fresh Nourishing Shampoo,Biotique,338,182,620,4.2,NA,NA,450,155,182,0,1,Shampoo,
464872,Biotique Bio Walnut Bark Volumizing Shampoo For Fine & Thinning Hair,Biotique,329,241,373,4.2,NA,NA,450,450,240,0,1,Shampoo,
952740,Biotique Advanced Organics Onion Black Seed Shampoo,Biotique,251,285,175,4.3,NA,NA,330,330,285,0,1,Shampoo,
464868,Biotique Bio Henna Leaf Fresh Texture Shampoo & Conditioner,Biotique,342,296,225,4.3,NA,NA,450,79,290,0,1,Shampoo,
1507000,Biotique Monsoon Haircare Combo,Biotique,440,343,34,4.2,NA,NA,593,440,340,0,1,,
952745,Biotique Advanced Organics Argan Oil From Morocco Shampoo,Biotique,251,445,91,4.1,NA,NA,330,330,444,0,1,Shampoo,
739751,Biotique Bio Kelp Shampoo & Thyme Volume Conditioner,Biotique,334,482,3,3.9,NA,NA,449,334,482,0,1,Combos @ Nykaa,
598207,Biotique Disney Kids Cars Apple Twist Shampoo,Biotique,144,471,13,4.4,NA,NA,169,169,471,0,1,Hair Care,
60315,Biotique Disney Baby Bio Green Apple Tearproof Shampoo,Biotique,149,524,61,4.5,NA,NA,175,175,525,0,1,Shampoo & Conditioner,
1506989,Biotique Hairfall Protection Combo For Fine/thinning Hair,Biotique,334,532,5,4.6,NA,NA,449,334,538,0,1,,
952743,Biotique Advanced Organics Banana Deeply Nourishing Shampoo,Biotique,251,527,50,4.3,NA,NA,330,330,540,0,1,Shampoo,
1506996,Biotique Total Anti-hairfall Essentails Combo For Fine/thinning Hair,Biotique,618,569,21,4.2,NA,NA,793,793,556,0,1,,
730077,Biotique Bio Kelp Protein Shampoo for Hair Growth Treatment -Pack of 2,Biotique,158,594,,4.1,NA,NA,198,158,598,0,1,Combos @ Nykaa,
730070,Biotique Bio Green Apple Shampoo & Conditioner - Pack of 2,Biotique,145,597,26,4.1,NA,NA,198,145,597,0,1,Combos @ Nykaa,
730113,Biotique Bio Neem Margosa Anti-Dandruff Shampoo & Conditioner - Pack Of 2,Biotique,158,639,20,4.1,NA,NA,198,158,644,0,1,Combos @ Nykaa,
730082,Biotique Bio Soya Protein Fresh Nourishing Shampoo - Pack Of 2,Biotique,152,696,6,4.1,NA,NA,198,152,695,0,1,Combos @ Nykaa,
952749,Biotique Advanced Organics Apple Cider Vinegar Clarify & Shine Shampoo,Biotique,251,756,22,4.1,NA,NA,330,330,747,0,1,Shampoo,
1488673,Tresemme Smooth & Shine Shampoo + Conditioner,Tresemme,744,525,,4.5,NA,NA,955,718,535,0,1,,
1488672,Tresemme Keratin Smooth Shampoo + Conditioner,Tresemme,629,530,8,4.6,NA,NA,1015,1011,550,0,1,,
3535712,Tresemme Thick & Full Shampoo + Conditioner,Tresemme,690,564,,4.7,NA,NA,840,690,571,0,1,,
430560,Tresemme Keratin Smooth Combo (Buy 1Ltr Shampoo and Get 190ml Conditioner Free),Tresemme,936,560,44,4.5,NA,NA,1170,936,563,0,1,Combos @ Nykaa,
1488674,Tresemme Keratin Smooth Shampoo + Conditioner + Serum,Tresemme,1072,557,,4.4,NA,NA,1365,1072,572,0,1,,
7678,Tresemme Climate Protection Shampoo,Tresemme,488,584,159,4.4,NA,NA,610,488,587,0,1,Shampoo,
982102,Tresemme Keratin Smooth Shampoo + Conditioner with Vega Hair Dryer Combo,Tresemme,1465,653,25,4.3,NA,NA,1839,1686,666,0,1,Combos @ Nykaa,
1031095,Tresemme Thick & Full Shampoo,Tresemme,70,667,8,4.3,NA,NA,70,70,678,0,1,Shampoo,
982101,Tresemme Hair Fall Defense Shampoo + Conditioner with Vega Hair Dryer Combo,Tresemme,1465,863,,4.3,NA,NA,1838,1686,872,0,1,Combos @ Nykaa,
2809954,Tresemme Keratin Smooth Shampoo + Hold Level 4 Hair Spray,Tresemme,1256,,,4.5,NA,NA,1570,1256,,0,1,,
780640,Tresemme Detox & Restore Combo Buy 580 ml Shampoo and Get 190ml Conditioner Free,Tresemme,623,,,4.4,NA,NA,830,623,,0,1,Combos @ Nykaa,
982105,Tresemme Botanique Shampoo + Conditioner with Vega Hair Dryer Combo,Tresemme,1457,,18,4.2,NA,NA,1829,1678,,0,1,Combos @ Nykaa,
208997,Tresemme Keratin Smooth With Argan Oil Shampoo,Tresemme,713,12,2543,4.4,NA,NA,950,713,12,0,1,Shampoo,
971624,Tresemme Keratin Smooth Shampoo + Conditioner Combo,Tresemme,915,28,1472,4.5,NA,NA,1345,915,25,0,1,Combos @ Nykaa,
7681,Tresemme Hair Fall Defense Shampoo,Tresemme,629,42,1342,4.4,NA,NA,839,713,43,0,1,Shampoo,
384438,Tresemme Keratin Smooth With Argan Oil Shampoo + Conditioner Combo,Tresemme,588,44,68,4.4,NA,NA,840,588,45,0,1,Combos @ Nykaa,
774828,Tresemme Pro Protect Sulphate Free Shampoo,Tresemme,628,61,1201,4.5,NA,NA,785,628,63,0,1,Shampoo,
864831,Tresemme Pro Protect Sulphate Free Combo,Tresemme,662,100,12,4.6,NA,NA,1104,662,105,0,1,Combos @ Nykaa,
117539,Tresemme Botanique Nourish & Replenish Shampoo,Tresemme,496,121,1666,4.4,NA,NA,620,496,124,0,1,Shampoo,
7679,Tresemme Smooth & Shine Shampoo,Tresemme,448,134,570,4.5,NA,NA,560,448,136,0,1,Shampoo,
5788860,TRESemme Pro Pure Damage Recovery Shampoo with Fermented Rice Water Paraben & Sulphate Free,Tresemme,450,151,13,4.5,NA,NA,500,450,155,0,1,Shampoo,
780639,Tresemme Nourish & Replenish Combo Buy 580 ml Shampoo and Get 190ml Conditioner Free,Tresemme,630,164,40,4.5,NA,NA,840,630,168,0,1,Combos @ Nykaa,
208994,Tresemme Keratin Smooth With Argan Oil Shampoo,Tresemme,180,224,2568,4.4,NA,NA,180,180,226,0,1,Shampoo,
881205,Tresemme Keratin Shampoo + Mask Combo,Tresemme,854,225,19,4.5,NA,NA,1220,854,230,0,1,Combos @ Nykaa,
430559,Tresemme Hair Fall Defense Combo (Buy 1Ltr Shampoo and Get 190ml Conditioner Free),Tresemme,854,279,89,4.5,NA,NA,1068,943,279,0,1,Combos @ Nykaa,
1488687,Tresemme Keratin Smooth Shampoo + Mask + Serum,Tresemme,1256,329,,4.5,NA,NA,1570,1256,326,0,1,,
774831,Tresemme Thick & Full Shampoo,Tresemme,128,339,25,4.3,NA,NA,150,128,346,0,1,Shampoo,
14684,Tresemme Hair Spa Rejuvenation Shampoo,Tresemme,488,341,505,4.4,NA,NA,610,488,349,0,1,Shampoo,
774832,Tresemme Thick & Full Shampoo,Tresemme,496,389,18,4.4,NA,NA,620,496,394,0,1,Shampoo,
117532,Tresemme Botanique Detox & Restore Shampoo,Tresemme,488,413,481,4.3,NA,NA,610,488,410,0,1,Shampoo,
5788864,TRESemme Pro Pure Moisture Boost Shampoo with Aloe Essence Sulphate Free & Paraben Free,Tresemme,450,377,4,4.8,NA,NA,500,450,374,0,1,Shampoo,
881204,Tresemme Keratin Haircare Combo,Tresemme,1440,493,74,4.5,NA,NA,1440,1440,499,0,1,Combos @ Nykaa,
546747,Head & Shoulders Smooth & Silky Shampoo,Head & Shoulders,712,106,258,4.4,NA,NA,890,688,108,0,1,Shampoo,
937932,Head & Shoulders Neem Anti-Dandruff Shampoo,Head & Shoulders,700,214,119,4.4,NA,NA,875,871,242,0,1,Shampoo,
4240687,Head & Shoulders 2-in-1 Anti-hairfall Anti-dandruff Shampoo + Conditioner In One,Head & Shoulders,450,265,7,4.4,NA,NA,899,719,260,0,1,,
546751,Head & Shoulders Anti Hair Fall Shampoo,Head & Shoulders,75,333,155,4.4,NA,NA,75,75,334,0,1,Shampoo,
546745,Head & Shoulders Cool Menthol 2-in-1 Anti-Dandruff Shampoo + Conditioner,Head & Shoulders,760,338,69,4.4,NA,NA,950,760,338,0,1,Shampoo,
359049,Head & Shoulders Silky Black Shampoo,Head & Shoulders,559,416,81,4.5,NA,NA,699,559,404,0,1,Shampoo,
442741,Head & Shoulders 2 in 1 Active Protect Anti Dandruff Shampoo + Conditioner,Head & Shoulders,660,402,102,4.4,NA,NA,825,660,409,0,1,,
10772,Head & Shoulders Anti Dandruff Lemon Fresh Shampoo,Head & Shoulders,170,476,153,4.4,NA,NA,170,170,478,0,1,Shampoo,
218621,Head & Shoulders Anti Hair Fall Shampoo,Head & Shoulders,592,577,141,4.4,NA,NA,740,592,574,0,1,Shampoo,
240535,Head & Shoulders Cool Menthol 2-in-1 Shampoo + Conditioner,Head & Shoulders,220,641,128,4.2,NA,NA,220,220,656,0,1,Shampoo,
5391987,Head & Shoulders 2 In 1 Anti Dandruff Shampoo & Smooth And Silky Conditioner,Head & Shoulders,1700,,4,4.4,NA,NA,1700,1700,,0,1,Combos @ Nykaa,
499339,Head & Shoulders Smooth & Silky Shampoo + Conditioner (Pack Of 2),Head & Shoulders,798,,11,4.5,NA,NA,798,798,,0,1,Combos @ Nykaa,
499307,Head & Shoulders Silky Black Anti Dandruff Shampoo (Pack Of 2),Head & Shoulders,630,,,4.7,NA,NA,630,630,,0,1,Combos @ Nykaa,
499308,Head & Shoulders Cool Menthol 2-in-1 Shampoo + Conditioner (Pack Of 2),Head & Shoulders,798,,,5,NA,NA,798,798,,0,1,Combos @ Nykaa,
499340,Head & Shoulders Anti Hair Fall Shampoo (Pack Of 2),Head & Shoulders,630,,,4.4,NA,NA,630,630,,0,1,Combos @ Nykaa,
