_id,product_asin,product_availability,product_best_seller_rank,product_bought_together,product_brand,product_category,product_description,product_details,product_fullfilled,product_icons,product_important_information,product_name,product_offers,product_original_price,product_rating,product_sale_price,product_subscription_discount,product_total_reviews,product_variations
{'$oid': '62848d6c1cfba6a787647180'},B08KRSQ1Y8,In stock,"#1,223 in Home & Kitchen  (See Top 100 in Home & Kitchen) #9 in Water Coolers, Filters & Cartridges","['HUL Pureit Eco Water Saver Mineral RO+UV+MF AS wall mounted/Counter top Black 10L W...', 'V-Guard Rejive RO+UV+MIN Water Purifier With 8 Stage Purification, Mineral Health C...', 'Eureka Forbes Aquaguard Aura RO+UV+UF+MTDS+Active Copper+Mineral Guard+UV E-boiling...', 'Faber RO+ MAT+Vitamin C,7 Liters Water purifier with 7Stage, Upto 2500 TDS, Black', 'Sure From Aquaguard Delight NXT RO+UV e-boiling+MTDS Water Purifier By Eureka Forbe...', 'AO Smith Z9 Hot+ normal RO |10 L|100%RO+SCMT(Silver Charged Membrane Tech.)|Mineral...', 'Faber FWP Galaxy PRO Reverse Osmosis Water Purifier 7L, black, ro+mat', 'AO Smith Z5 Water Purifier, Baby Safe Water with 8 Stage Purification, 100% RO+SCMT...', 'HUL Pureit Copper+ Mineral RO + UV + MF 7 stage Table top / Wall Mountable Black & ...', 'Faber Galaxy Pro Plus RO+UV+ MAT,7 Liters, 7 Stage Mineral Water Purifier with Upto...']",V-Guard,"['Home & Kitchen', 'Kitchen & Home Appliances', 'Water Purifiers & Accessories', 'Water Filters & Purifiers']",,"{'Brand': 'V-Guard', 'Manufacturer': 'V-Guard Industries Ltd., Kochi, Kerala, V-Guard Industries Ltd. 42/962, Vennala High School Road, Vennala, Kochi- 682028, Kerala, India.', 'Country of Origin': 'India', 'Model Number': 'Zenora', 'Colour': 'White', 'Special Feature': 'UV, RO', 'Item Weight': '9 kg 400 g', 'Product Dimensions': '34.5 x 20.5 x 45 cm; 9.4 Kilograms', 'Item model number': 'Zenora', 'Item Height': '45 Centimeters', 'Item Width': '20.5 Centimeters', 'Power source type': 'Corded Electric', 'Included Components': '1 N Water Purifier, 1 N Pre-Filter, 1 N User Manual, 1 N Wall Mounting Kit, 1 N Integrated Diverter Valve, 1 N 3/8"" White Tube, 1 N 1/4"" White Tube, 1 N SMPS Adapter, 1 N RO Membrane', 'Input Type': 'Hard', 'ASIN': 'B08KRSQ1Y8', 'Date First Available': '6 October 2020', 'Item Dimensions LxWxH': '34.5 x 20.5 x 45 Centimeters', 'Generic Name': 'Water Purifier', 'Customer Reviews': '4.3 out of 5 stars 3,636 ratings', 'Best Sellers Rank': '#1,223 in Home & Kitchen  (See Top 100 in Home & Kitchen) #9 in Water Coolers, Filters & Cartridges'}",,"['Pay on Delivery', '10 days Replacement', 'Amazon Delivered', '1 Year Warranty']",,"V-Guard Zenora RO+UV+MB 7 Litre Water Purifier With 8 Stage Purification and pH Balancer, Free Installation & Free External Pre-Filters",3.0,15949.0,4.3 out of 5 stars,10199.0,,"3,636 ratings",[]
{'$oid': '62848d6d1cfba6a7876471b3'},B01MYH9UZL,In stock,,[],HUL Pureit,"['Home & Kitchen', 'Kitchen & Home Appliances', 'Water Purifiers & Accessories', 'Water Filters & Purifiers']","Protects your purifier from sudden voltage fluctuation as high as 280 volts and also works in as low as 100 VAC. Height: 297 mm Width: 199 mm Depth: 435 mm Weight: 7.3 kgs Purified water flow rate[Average]: Approximately 10 - 12 Litre per hour Water storage capacity: 10 Litres 6 Stage purifying technology: Pre-Sediment Filter, Pre-RO Carbon Filter, Mini Filter, Reverse Osmosis Membrane, Micro Filtration Membrane/UV and Post-RO Carbon Filter Membrane type: Thin film composite spiral wound Pump Type: Diaphragm pump, 24V DC, Recovery: Typically 25 percent TDS Reduction: 90 percent (Min) Power Rating: 55 Watts Pressure rating: 10-30 PSI,Input Voltage: 165 - 240 VAC 50 Hz Material of construction: Food grade, non-toxic, engineering grade plastics Length of Power Adapter: 1.5 metres Total Dissolved Solids: Upto 1800 mg per lit Total Hardness: 500 mg per lit (max) Iron: 0.3 mg per lit (max) Turbidity: 1 NTU (Max) Germ kill KitTM Purification capacity: Germ kill Kit-1 has been designed to give approximately 4000L of purified water depending on the input water pressure, TDS and water temperature Purification capacity (CSF Germ kill KitTM): Removes dissolved salts, hardness, pesticides and heavy metals like arsenic, lead and mercury. It also removes microbial contaminants like bacteria, virus, protozoa and cysts. Germ kill performance standard: Meets stringent international criteria for microbiologically safe drinking water - e.g., Environmental Protection Agency (EPA), USA Depends on your water quality. Pure refers to TDS range of water. 10 litres only with running water or else 9.2 litres of water dispensing. #Total Dissolved Solids (TDS) is the purity measured. Purity Indicator shows the approximate range of TDS in water. The input TDS IN level is derived through a reverse percentage calculation from the TDS OUT level measured through the sensor, based on 90 percent TDS removal rate of RO membrane.","{'Manufacturer': 'HUL Pureit', 'Country of Origin': 'India', 'Item model number': 'WCRX100', 'Product Dimensions': '19.9 x 29.7 x 43.5 cm; 7.3 Kilograms', 'ASIN': 'B01MYH9UZL', 'Item Weight': '7 kg 300 g', 'Item Dimensions LxWxH': '19.9 x 29.7 x 43.5 Centimeters', 'Included Components': '1 water purifier'}",,"['10 days Replacement', 'Amazon Delivered', 'No-Contact Delivery']",,HUL Pureit Mineral RO+MF 6 Stage 6L Water Purifier,3.0,10500.0,3.5 out of 5 stars,9920.0,,38 ratings,[]
{'$oid': '62848d6f1cfba6a7876471b7'},B09GVJWVTK,In stock,"#27,942 in Home & Kitchen  (See Top 100 in Home & Kitchen) #115 in Water Coolers, Filters & Cartridges",[],Generic,"['Home & Kitchen', 'Kitchen & Home Appliances', 'Water Purifiers & Accessories', 'Water Filters & Purifiers']",,"{'Brand': 'Generic', 'Manufacturer': 'Generic', 'Country of Origin': 'India', 'Colour': 'White', 'Special Feature': 'UV, UF, RO', 'Item Weight': '8 kg 520 g', 'Package Dimensions': '63.4 x 45.2 x 27.4 cm; 8.52 Kilograms', 'Item part number': 'PW-Purifier 12L -2', 'Included Components': 'Water Purifier', 'ASIN': 'B09GVJWVTK', 'Date First Available': '22 September 2021', 'Customer Reviews': '5.0 out of 5 stars 2 ratings', 'Best Sellers Rank': '#27,942 in Home & Kitchen  (See Top 100 in Home & Kitchen) #115 in Water Coolers, Filters & Cartridges'}",,"['10 days Replacement', 'Amazon Delivered', 'No-Contact Delivery']",,Plastic Aqua Grand smart + 12 Litres RO UV UF TDS Water Purifier || White || 12 L || 1Pc,3.0,9999.0,5.0 out of 5 stars,3587.0,,2 ratings,[]
{'$oid': '62848d701cfba6a7876471b9'},B09YY5BP26,In stock,"#48,410 in Home & Kitchen  (See Top 100 in Home & Kitchen) #181 in Water Coolers, Filters & Cartridges","['HUL Pureit Eco Water Saver Mineral RO+UV+MF AS wall mounted/Counter top Black 10L W...', 'Eureka Forbes Aquaguard Aura RO+UV+UF+MTDS+Active Copper+Mineral Guard+UV E-boiling...', 'Havells Digi Touch Alkaline 6 L Absolutely Safe RO + UV Purified pH Balanced Water ...', 'KENT 11133 Supreme Copper Next Gen RO Water Purifier | Makes Water 100% Pure 8 L | ...', 'Faber RO+ MAT+Vitamin C,7 Liters Water purifier with 7Stage, Upto 2500 TDS, Black', 'Addyz Fully Automatic RO+UV+UF 12 Litres Storage Water Purifier with Silver impregn...', 'Havells FAB Alkaline 7 L Absolutely Safe RO + UV Purified Alkaline Water Technology...', 'AO Smith Z9 Hot+ normal RO |10 L|100%RO+SCMT(Silver Charged Membrane Tech.)|Mineral...', 'Aquadpure Alkaline + ORP with Active Copper + RO + UV + UF + TDS Controller/Adjuste...', 'Faber FWP Neutron PRO Alkaline, Ultraviolet Water Purifier 10L', 'HUL Pureit Eco Water Saver Mineral RO+UV+MF AS wall mounted/Counter top Black 10L W...', 'Eureka Forbes Aquaguard Aura RO+UV+UF+MTDS+Active Copper+Mineral Guard+UV E-boiling...', 'Havells Digi Touch Alkaline 6 L Absolutely Safe RO + UV Purified pH Balanced Water ...', 'Faber RO+ MAT+Vitamin C,7 Liters Water purifier with 7Stage, Upto 2500 TDS, Black', 'Havells FAB Alkaline 7 L Absolutely Safe RO + UV Purified Alkaline Water Technology...', 'AO Smith Z9 Hot+ normal RO |10 L|100%RO+SCMT(Silver Charged Membrane Tech.)|Mineral...', 'Faber FWP Neutron PRO Alkaline, Ultraviolet Water Purifier 10L', 'Faber FWP Galaxy PRO Reverse Osmosis Water Purifier 7L, black, ro+mat', 'HUL Pureit Copper+ Mineral RO + UV + MF 7 stage Table top / Wall Mountable Black & ...', 'KENT 11133 Supreme Copper Next Gen RO Water Purifier | Makes Water 100% Pure 8 L | ...']",Aquadpure,"['Home & Kitchen', 'Kitchen & Home Appliances', 'Water Purifiers & Accessories', 'Water Filters & Purifiers']",Specifications: Copper Filter: Copper Filter RO water purifier provides the goodness of copper. Copper-infused water has anti-microbial and anti-inflammatory properties best suitable for the home. Hi TDS Membrane: Best-in-class membrane efficiently removes all impurities from water and provides safe and pure water always while saving up to 100% more water compared to conventional purifiers with 25% recovery TDS Regulator: Equipped with an advanced TDS regulator; it adjusts the taste of water as per the source. Auto Shut OFF: Fully automatic shut off function which automatically switched off the Machine when its water tanks get full Capacity:Up to 12 L per hour Body Material: ABS Food Grade Plastic Mounting filter assembly with 12 L water storage capacity Maximum Duty Cycle: 80 to 100 L/day Voltage:24 V DC Input and Electric Power Supply: Single Phase 220 10 V AC; 50 Hz Activated carbon Filter: It takes out 99% of chlorine and organic chemicals. It provides an enhanced reduction of odor and color. Ultraviolet: The UV light will disinfect filter water at a normal flow rate; Providing one of the safest filtering systems available. Installation: Contact Customer Care for paid installation (Charges @499/- rs. as per Location),"{'Brand': 'Aquadpure', 'Manufacturer': 'Aquadpure Water System, Aquadpure Water System Toll - Free No.- 1800-890-4088 Mobile No. -8815585020, 8103536881', 'Country of Origin': 'India', 'Model Number': 'Copper RO Water Purifier', 'Colour': 'Clear Black', 'Number of Memory Sticks': '1', 'Special Feature': 'Automatic Shut-Off', 'Item Weight': '425 g', 'Product Dimensions': '39 x 29 x 54 cm; 425 Grams', 'Item model number': 'Copper RO Water Purifier', 'Item Height': '54 Centimeters', 'Item Width': '29 Centimeters', 'Voltage': '220 Volts', 'Wattage': '30 Watt Hours', 'Power source type': 'Corded Electric', 'Included Components': 'MAIN UNIT, WARRANTY CARD, INSTALLATION KIT AND COMPLETE PRE FILTER ASSEMBLY (SAFELY PUT INSIDE STORAGE TANK', 'ASIN': 'B09YY5BP26', 'Date First Available': '25 April 2022', 'Packer': 'Aquadpure Water System', 'Importer': 'Aquadpure Water System', 'Item Dimensions LxWxH': '39 x 29 x 54 Centimeters', 'Net Quantity': '1.00 Set', 'Generic Name': 'Ro Water Purifier', 'Customer Reviews': '5.0 out of 5 stars 1 rating', 'Best Sellers Rank': '#48,410 in Home & Kitchen  (See Top 100 in Home & Kitchen) #181 in Water Coolers, Filters & Cartridges'}",,"['Pay on Delivery', '10 Days Returnable', 'Amazon Delivered', '1 Year Warranty']",,Aquadpure Copper RO Water Purifier | 12 L | RO+UV+UF+ Active Copper+TDS Control+UV | Purified Water with Goodness of Copper,3.0,15499.0,5.0 out of 5 stars,5399.0,,1 rating,[]
{'$oid': '62848d741cfba6a7876471c0'},B07HH7CLCX,In stock,"#816,305 in Home & Kitchen  (See Top 100 in Home & Kitchen) #1,980 in Water Coolers, Filters & Cartridges",[],CUCKOO,"['Home & Kitchen', 'Kitchen & Home Appliances', 'Water Purifiers & Accessories', 'Water Filters & Purifiers']",,"{'Brand': 'CUCKOO', 'Manufacturer': 'CUCKOO, Cuckoo Homesys Co Ltd. 349, Emtibeuibuk-ro, Siheung-si, Gyeonggi-do, Korea', 'Country of Origin': 'Republic of Korea', 'Model Number': 'CP-FR601HW/WHCKIN', 'Colour': 'White', 'Number of Memory Sticks': '1', 'Special Feature': 'Pre Filter, Sediment, Pre-Carbon, RO Filter and Natural Plus Filter', 'Item Weight': '16 kg 500 g', 'Product Dimensions': '48.2 x 26 x 50.5 cm; 16.5 Kilograms', 'Item model number': 'CP-FR601HW/WHCKIN', 'Item Height': '50.5 Centimeters', 'Item Width': '26 Centimeters', 'Wattage': '400 Watts', 'Included Components': '1 Unit, 1 Booster Pump, 1 User Mannual & Installation Kit', 'Are Batteries Included': 'No', 'ASIN': 'B07HH7CLCX', 'Date First Available': '18 September 2018', 'Packer': 'Cuckoo Consumer Products Private Limited, A 42/4, 10Th Floor Priska Pride Tower, Industrial Area, Sector 62, Noida, Uttar Pradesh 201301', 'Importer': 'Cuckoo Appliances Private Limited, A 42/4, 10Th Floor Priska Pride Tower, Industrial Area, Sector 62, Noida, Uttar Pradesh 201301', 'Item Dimensions LxWxH': '48.2 x 26 x 50.5 Centimeters', 'Net Quantity': '1 count', 'Generic Name': 'Hot and Cold Eco RO Water Purifier', 'Customer Reviews': '3.2 out of 5 stars 10 ratings', 'Best Sellers Rank': '#816,305 in Home & Kitchen  (See Top 100 in Home & Kitchen) #1,980 in Water Coolers, Filters & Cartridges'}",,"['10 days Replacement', 'Amazon Delivered', '2 Year Warranty', 'No-Contact Delivery']",,"CUCKOO Fusion Top RO Alkaline Water Purifier with Hot & Cold Alkaline Water, Stainless Steel Tank, Dual Faucet - 5.2 litres (CP-FR601HW)",3.0,41990.0,3.2 out of 5 stars,37791.0,,10 ratings,[]
{'$oid': '62848d751cfba6a7876471c2'},B08Y5NGWVY,In stock,"#29,722 in Home & Kitchen  (See Top 100 in Home & Kitchen) #118 in Water Coolers, Filters & Cartridges","['Purella Ortho Wall Mountable or Under the Sink RO Water Purifier with Faucet and 15...', 'AO Smith Z2+ Under The Counter RO+MIN-TECH Water Purifier - 5 L', 'KENT Excell Plus RO Water Purifier (11003) | RO+UV+UF+TDS Controller | Under the Co...', 'CLEAN JAL Under Sink RO Water Purifier - Best Under Sink Water Purifier for Home RO...', 'Hydroshell 25 LPH Commercial RO Water Purifier Plant Double Purification Blue Stain...', 'HUL Pureit Eco Water Saver Mineral RO+UV+MF AS wall mounted/Counter top Black 10L W...', 'Kent Sterling Plus RO+UV+UF+TDS Cont. Under The Sink RO Water Purifier, 6 Liter', 'B. Nova Non-Electric Non RO | 4 Stage Alkaline Water Purifier Home and Office | Wit...', 'Eureka Forbes Aquaguard Aura RO+UV+UF+MTDS+Active Copper+Mineral Guard+UV E-boiling...', 'Havells Digi Touch Alkaline 6 L Absolutely Safe RO + UV Purified pH Balanced Water ...']",AquaDart,"['Home & Kitchen', 'Kitchen & Home Appliances', 'Water Purifiers & Accessories', 'Water Filters & Purifiers']",It is 5 Stage Electrical UV Water Purifier. It is Under sink and Wall Mounted.,"{'Brand': 'AquaDart', 'Manufacturer': 'AquaDart', 'Country of Origin': 'India', 'Special Feature': 'UV, RO', 'Item Weight': '950 g', 'Product Dimensions': '15 x 12 x 18 cm; 950 Grams', 'Item part number': 'UV', 'Item Height': '18 Centimeters', 'Item Width': '12 Centimeters', 'Power source type': 'Corded Electric', 'Included Components': 'Installation Kit', 'ASIN': 'B08Y5NGWVY', 'Date First Available': '5 March 2021', 'Item Dimensions LxWxH': '15 x 12 x 18 Centimeters', 'Customer Reviews': '4.2 out of 5 stars 25 ratings', 'Best Sellers Rank': '#29,722 in Home & Kitchen  (See Top 100 in Home & Kitchen) #118 in Water Coolers, Filters & Cartridges'}",,"['10 days Replacement', 'Amazon Delivered', '1 Year Warranty', 'No-Contact Delivery']",,"AquaDartÂ® UV Water Purifier 5 Stage Under sink and Wall Mounted 30-35 liters per Hour (No TDS Reduction, No water wastage and No RO, only UV Water Purifier",3.0,19999.0,4.2 out of 5 stars,2249.0,,25 ratings,[]
{'$oid': '628490431cfba6a78764725e'},B08KFRFSP9,In stock,,"['Faber RO+ MAT+Vitamin C,7 Liters Water purifier with 7Stage, Upto 2500 TDS, Black', 'HUL Pureit Eco Water Saver Mineral RO+UV+MF AS wall mounted/Counter top Black 10L W...', 'Faber FWP Galaxy PRO Reverse Osmosis Water Purifier 7L, black, ro+mat', 'Faber Galaxy Pro Plus RO+UV+ MAT,7 Liters, 7 Stage Mineral Water Purifier with Upto...', 'Faber Galaxy Fresh Alkaline RO+UV+MAT, 7 Liters, 8 Stage Water Purifier with Upto 2...', 'Eureka Forbes Aquaguard Aura RO+UV+UF+MTDS+Active Copper+Mineral Guard+UV E-boiling...', 'Havells FAB Alkaline 7 L Absolutely Safe RO + UV Purified Alkaline Water Technology...', 'Sure From Aquaguard Delight NXT RO+UV e-boiling+MTDS Water Purifier By Eureka Forbe...', 'AO Smith Z9 Hot+ normal RO |10 L|100%RO+SCMT(Silver Charged Membrane Tech.)|Mineral...', 'V-Guard Zenora RO+UF+MB 7 Litre Water Purifier With 7 Stage Purification and pH Bal...']",Faber,"['Home & Kitchen', 'Kitchen & Home Appliances', 'Water Purifiers & Accessories', 'Water Filters & Purifiers']",,"{'Manufacturer': 'Faber, 1800-209-3484', 'Country of Origin': 'India', 'Item model number': 'FWP Neutron PRO', 'Product Dimensions': '29 x 41 x 63 cm; 6.5 Kilograms', 'ASIN': 'B08KFRFSP9', 'Packer': '1800-209-3484', 'Item Weight': '6 kg 500 g', 'Item Dimensions LxWxH': '29 x 41 x 63 Centimeters', 'Included Components': 'Water purifier, User manual, Warranty card and Installation kit', 'Generic Name': 'Water Purifier'}",,"['Pay on Delivery', '10 days Replacement', 'Amazon Delivered', '1 Year Warranty']",,"Faber FWP Neutron PRO Alkaline, Ultraviolet Water Purifier 10L",3.0,,3.6 out of 5 stars,9690.0,,102 ratings,[]
{'$oid': '628490511cfba6a7876472b7'},B099KN49DG,Only 1 left in stock,"#53,775 in Home & Kitchen  (See Top 100 in Home & Kitchen) #198 in Water Coolers, Filters & Cartridges","['HUL Pureit Eco Water Saver Mineral RO+UV+MF AS wall mounted/Counter top Black 10L W...', 'AO Smith Z9 Hot+ normal RO |10 L|100%RO+SCMT(Silver Charged Membrane Tech.)|Mineral...', 'Sure From Aquaguard Delight NXT RO+UV e-boiling+MTDS Water Purifier By Eureka Forbe...', 'Faber RO+ MAT+Vitamin C,7 Liters Water purifier with 7Stage, Upto 2500 TDS, Black', 'Havells Digi Touch Alkaline 6 L Absolutely Safe RO + UV Purified pH Balanced Water ...', 'AO Smith Z8 Hot+ normal RO |10 L storage|100%RO+SCMT(Silver Charged Membrane Tech.)...', 'Faber FWP Galaxy PRO Reverse Osmosis Water Purifier 7L, black, ro+mat', 'Havells FAB Alkaline 7 L Absolutely Safe RO + UV Purified Alkaline Water Technology...', 'Addyz Fully Automatic RO+UV+UF 12 Litres Storage Water Purifier with Silver impregn...', 'Eureka Forbes Aquaguard Aura RO+UV+UF+MTDS+Active Copper+Mineral Guard+UV E-boiling...']",BePURE,"['Home & Kitchen', 'Kitchen & Home Appliances', 'Water Purifiers & Accessories', 'Water Filters & Purifiers']",,"{'Brand': 'BePURE', 'Manufacturer': 'Bepure Tech Pvt Ltd, Bepure Tech Pvt Ltd. Call 1800 123 9411 Email: sales@bepuretech.com', 'Country of Origin': 'India', 'Model Number': 'RO+UV+UF+TDS+Alkaline', 'Colour': 'Blue', 'Special Feature': 'UV, UF, RO', 'Package Dimensions': '65 x 45 x 34 cm', 'Item model number': 'RO+UV+UF+TDS+Alkaline', 'Wattage': '60 Watts', 'Power source type': 'Corded-electric', 'Included Components': 'Fittings And Manual', 'ASIN': 'B099KN49DG', 'Date First Available': '14 July 2021', 'Packer': 'Bepure Tech Pvt Ltd. Call 1800 123 9411 Email: sales@bepuretech.com', 'Customer Reviews': '4.3 out of 5 stars 146 ratings', 'Best Sellers Rank': '#53,775 in Home & Kitchen  (See Top 100 in Home & Kitchen) #198 in Water Coolers, Filters & Cartridges'}",,"['10 days Replacement', 'Amazon Delivered', '1 Year Warranty', 'No-Contact Delivery']",,Bepure 3G pH Hot and Normal 9L RO+UV+UF+TDS+ Alkaline Water Purifier with hot water function| 8 Stage Water Purification| Best Alkaline Water Purifier for home| Works Up to 3000 ppm TDS,3.0,22999.0,4.3 out of 5 stars,13999.0,,146 ratings,[]
{'$oid': '628490511cfba6a7876472b9'},B08JZHZFRS,In stock,"#119,405 in Home & Kitchen  (See Top 100 in Home & Kitchen) #388 in Water Coolers, Filters & Cartridges",[],Kinsco,"['Home & Kitchen', 'Kitchen & Home Appliances', 'Water Purifiers & Accessories', 'Water Filters & Purifiers']",,"{'Brand': 'Kinsco', 'Manufacturer': 'Kinetic Sales Corporation', 'Country of Origin': 'India', 'Special Feature': 'UV, UF, RO', 'Item Weight': '8 kg 280 g', 'Package Dimensions': '57.6 x 47.6 x 28.2 cm; 8.28 Kilograms', 'Item part number': 'kin-aq-style-filter', 'Power source type': 'Corded Electric', 'Included Components': 'User Manual', 'Input Type': 'Hard', 'ASIN': 'B08JZHZFRS', 'Date First Available': '24 September 2020', 'Customer Reviews': '4.1 out of 5 stars 237 ratings', 'Best Sellers Rank': '#119,405 in Home & Kitchen  (See Top 100 in Home & Kitchen) #388 in Water Coolers, Filters & Cartridges'}",,"['Pay on Delivery', '10 days Replacement', 'Amazon Delivered', '1 Year Warranty']",1 year warranty on electrical items. For every visit customer need to pay extra. For more info call 1800-212-6766 (Monday to Saturday) 10:00 AM to 6:00 PM.,Kinsco Aqua Style 15 Litre Tank RO + UV + UF + TDS Adjuster Pure Water Purifier Dispenser Machine (With Free Pre Filter),3.0,20000.0,4.1 out of 5 stars,5659.0,,237 ratings,[]
{'$oid': '62885d581cfba6a787655208'},B00GX91YA2,In stock,,[],KENT,"['Home & Kitchen', 'Kitchen & Home Appliances', 'Water Purifiers & Accessories', 'Water Filters & Purifiers']",,"{'Manufacturer': 'KENT RO SYSTEMS LTD, Kent RO Systems Ltd.- Khasra No. 93, Village- Bantakhedi, Tehsil- Roorkee, District- Haridwar, Uttrakhand- 247668, India', 'Country of Origin': 'India', 'Imported By': 'KENT RO SYSTEM LTD- A-06, PHASE-2,NOIDA, UTTAR PRADESH, INDIA PIN-201305', 'Item model number': 'Gold Star', 'Product Dimensions': '37.5 x 23 x 33 cm; 4.2 Kilograms', 'ASIN': 'B00GX91YA2', 'Packer': 'Kent RO Systems Ltd.- Khasra No. 93, Village- Bantakhedi, Tehsil- Roorkee, District- Haridwar, Uttrakhand- 247668, India', 'Importer': 'KENT RO SYSTEM LTD- A-06, PHASE-2,NOIDA, UTTAR PRADESH, INDIA PIN-201305', 'Item Weight': '4 kg 200 g', 'Item Dimensions LxWxH': '37.5 x 23 x 33 Centimeters', 'Net Quantity': '2 N', 'Included Components': 'Bottom tank-01, Top Tank with Fitting- 01, Middle Partition-01, Top Cover-01, Top Lid-01, Carbon Assembly with Inlet Funnel-01 Set, Hollow Fiber UF Membrane Cartridge-01, Spare Sediment Filter-1 Pair, 50ml Cleaning Syringe-01, Y-Fork-01, Tap-01, Center Drill Sticker-01, Screw and Plastic Inserts- 2 no each, Instruction Manual-01', 'Generic Name': 'Gravity Water Purifier'}",,"['Pay on Delivery', '10 days Replacement', 'Amazon Delivered', 'Warranty Policy']",WE SHALL HAVE FULL RIGHT TO CANCEL ALL THOSE ORDERS WHICH ARE NOT SERVICED WITH OUR COURIER PARTNER.SO KINDLY COOPERATE WITH US,KENT Gold Star 22 litres Gravity-Based Water Purifier,3.0,3200.0,3.8 out of 5 stars,2449.0,,"1,176 ratings",[]
{'$oid': '62885d581cfba6a78765520a'},B09XK3QJZ6,In stock,"#167,588 in Home & Kitchen  (See Top 100 in Home & Kitchen) #540 in Water Coolers, Filters & Cartridges","['HUL Pureit Eco Water Saver Mineral RO+UV+MF AS wall mounted/Counter top Black 10L W...', 'Havells Fab UV Storage Water purifier with 5 Stages (White and Green, 7 litre)', 'Havells FAB Alkaline 7 L Absolutely Safe RO + UV Purified Alkaline Water Technology...', 'Havells Delite DX 100% RO+UV, pH balanced SS Tank Water Purifier', 'Havells Digi Touch Alkaline 6 L Absolutely Safe RO + UV Purified pH Balanced Water ...', 'Livguard Inverter with Smart Artificial Intelligence, Best in Class 3 Years Warrant...', 'Havells FAB 7 Litre Absoulety Safe RO + UV Water Purifer with 7 Stages, Patented Co...', 'B. Nova Non-Electric Non RO | 4 Stage Alkaline Water Purifier Home and Office | Wit...', 'Blue Star Excella 6 L RO + UV + UF Water Purifier, Black, EX5BLAM02', 'B.NOVA Gold 3 Stage | ALKALINE water Purifiers home and Office |filters Non-Electri...']",Toshiba,"['Home & Kitchen', 'Kitchen & Home Appliances', 'Water Purifiers & Accessories', 'Water Filters & Purifiers']","Protect your family from the dangers of contaminated drinking water by bringing home Toshiba Ultra Storage 8 L UV + UF Water Purifier. This essential kitchen appliance features a Double Purification Process, Computer Controlled Operation, and a Wall-mountable Design to offer you safe drinking water.","{'Brand': 'Toshiba', 'Manufacturer': 'Midea India Pvt Ltd', 'Country of Origin': 'China', 'Colour': 'White', 'Number of Memory Sticks': '1', 'Special Feature': 'UV, UF', 'Item Weight': '2 kg 700 g', 'Package Dimensions': '34 x 26.5 x 25 cm; 2.7 Kilograms', 'Item part number': 'N1748TUF', 'Power source type': 'Corded Electric', 'Included Components': 'Water Purifier, User Manual, Connecting Tube, Connector, Ball Valve, Tube Lock', 'ASIN': 'B09XK3QJZ6', 'Date First Available': '9 April 2022', 'Net Quantity': '1.00 Unit', 'Best Sellers Rank': '#167,588 in Home & Kitchen  (See Top 100 in Home & Kitchen) #540 in Water Coolers, Filters & Cartridges'}",,"['Pay on Delivery', '10 days Replacement', 'Amazon Delivered', 'No-Contact Delivery']",,"Toshiba 8 L UV + UF Water Purifier with Free Installation, PURETRAC DISPLAY, LAST POINT PURIFICATION, REPLACEABLE TANK, Last Touch Cold Cathode UV (TWP-N1748TUF, White)",3.0,14990.0,,7990.0,,,[]
